{
  "$schema": "https://json-schema.org/draft/2020-12/schema",
  "$id": "https://github.com/SolusQuest/contract-scribe/schemas/validation/m1-host-validation-review-v1.schema.json",
  "type": "object",
  "required": [
    "formatVersion",
    "reviewId",
    "bundleId",
    "reviewedSourceRevision",
    "reviewerKind",
    "relaySessionId",
    "relayTaskId",
    "verdict",
    "blockingFindingIds",
    "reviewedAtUtc"
  ],
  "properties": {
    "formatVersion": {
      "const": "contractscribe-m1-host-validation-review-v1"
    },
    "reviewId": {
      "type": "string",
      "pattern": "^review\\.[0-9a-f]{64}$"
    },
    "bundleId": {
      "type": "string",
      "pattern": "^m1hvp1\\.[0-9a-f]{64}$"
    },
    "reviewedSourceRevision": {
      "type": [
        "string",
        "null"
      ]
    },
    "reviewerKind": {
      "type": [
        "string",
        "null"
      ]
    },
    "relaySessionId": {
      "type": [
        "string",
        "null"
      ]
    },
    "relayTaskId": {
      "type": [
        "string",
        "null"
      ]
    },
    "verdict": {
      "enum": [
        "pending",
        "accepted"
      ]
    },
    "blockingFindingIds": {
      "type": "array",
      "maxItems": 128,
      "uniqueItems": true,
      "items": {
        "type": "string",
        "minLength": 1,
        "maxLength": 96
      }
    },
    "reviewedAtUtc": {
      "type": [
        "string",
        "null"
      ]
    }
  },
  "additionalProperties": false,
  "allOf": [
    {
      "if": {
        "properties": {
          "verdict": {
            "const": "pending"
          }
        },
        "required": [
          "verdict"
        ]
      },
      "then": {
        "properties": {
          "reviewedSourceRevision": {
            "type": "null"
          },
          "reviewerKind": {
            "type": "null"
          },
          "relaySessionId": {
            "type": "null"
          },
          "relayTaskId": {
            "type": "null"
          },
          "blockingFindingIds": {
            "const": [
              "independent-review.pending"
            ]
          },
          "reviewedAtUtc": {
            "type": "null"
          }
        }
      },
      "else": {
        "properties": {
          "reviewedSourceRevision": {
            "type": "string",
            "pattern": "^[0-9a-f]{40}$"
          },
          "reviewerKind": {
            "const": "independent-relay"
          },
          "relaySessionId": {
            "type": "string",
            "format": "uuid"
          },
          "relayTaskId": {
            "type": "string",
            "format": "uuid"
          },
          "blockingFindingIds": {
            "const": []
          },
          "reviewedAtUtc": {
            "type": "string",
            "format": "date-time"
          }
        }
      }
    }
  ]
}
