{"blockingFindingIds":["independent-review.pending"],"bundleId":"m1hvp1.5b50beaf14127ffeac1811be429dca630b5ee62117269dcb3a7b0dd26a92b7ce","formatVersion":"contractscribe-m1-host-validation-review-v1","relaySessionId":null,"relayTaskId":null,"reviewId":"review.f33adb0bb740c96b0fbb64a02477aa66a6ecc11162d3cd4cfbed6fbc668ab9b4","reviewedAtUtc":null,"reviewedSourceRevision":null,"reviewerKind":null,"verdict":"pending"}
